drug,country,analysis
Vyvanse,Sweden,"{'legal_status': 'prescription-only', 'availability': 'restricted', 'prescription_requirements': 'A prescription is required from a licensed healthcare provider after a thorough medical evaluation.', 'regulations': 'It is illegal to buy, sell, or distribute Vyvanse without a prescription. Prescribed individuals must store it securely and not share it with others.'}"
Vyvanse,Switzerland,"{'legal_status': 'prescription-only', 'availability': 'easily available', 'prescription_requirements': 'A valid prescription from a licensed healthcare provider is required.', 'regulations': 'Covered by Swiss Mandatory Health Insurance (MHI); available at pharmacies.'}"
Vyvanse,Turkey,"{'legal_status': 'illegal', 'availability': 'not available', 'prescription_requirements': 'Prescription required for legal alternatives (e.g., methylphenidate)', 'regulations': 'Amphetamines, including Vyvanse, are not permitted; only methylphenidate can be prescribed.'}"
Vyvanse,United Kingdom,"{'legal_status': 'prescription-only', 'availability': 'restricted', 'prescription_requirements': 'Must register with a doctor in the UK and obtain a local prescription', 'regulations': 'Class B drug in the UK; cannot use a foreign prescription'}"
Vyvanse,United States,"{'legal_status': 'prescription-only', 'availability': 'restricted', 'prescription_requirements': 'Thorough medical evaluation and diagnosis of conditions like ADHD or binge eating disorder', 'regulations': 'Controlled substance in Schedule II category; subject to strict regulations due to potential for misuse and dependence.'}"
Strattera,Australia,"{'legal_status': 'prescription-only', 'availability': 'restricted', 'prescription_requirements': 'Prescription from an authorized health practitioner', 'regulations': 'Not recommended for patients with certain heart conditions; dosage must be determined by a physician.'}"
Strattera,Austria,"{'legal_status': 'prescription-only', 'availability': 'restricted', 'prescription_requirements': 'A prescription must include elements specified in Commission Implementing Directive 2012/52/EU. It generally loses validity twelve months after issue unless stated otherwise by the prescribing doctor.', 'regulations': ""Medicinal products can be prescribed from other EU Member States. Pharmacists can refuse to dispense if there are doubts about the prescription's authenticity or comprehensibility.""}"
Strattera,Belgium,"{'legal_status': 'prescription-only', 'availability': 'restricted', 'prescription_requirements': 'A valid prescription from a licensed healthcare provider is required to obtain Strattera.', 'regulations': 'Strattera can only be marketed in Belgium if it is authorized or registered with the FAMHP.'}"
Strattera,Canada,"{'legal_status': 'prescription-only', 'availability': 'easily available', 'prescription_requirements': 'A prescription from a licensed healthcare provider is required.', 'regulations': 'Regular monitoring of heart rate and blood pressure is advised during treatment.'}"
Strattera,Chile,"{'legal_status': 'prescription-only', 'availability': 'restricted', 'prescription_requirements': 'A valid prescription from a licensed health care provider is required to obtain Strattera.', 'regulations': 'Prescription medications can only be obtained with a valid prescription, and common medicines can be bought over the counter.'}"
Strattera,Colombia,"{'legal_status': 'prescription-only', 'availability': 'not available', 'prescription_requirements': 'valid prescription from a local doctor', 'regulations': 'centralized jurisdiction over drugs at INVIMA'}"
Strattera,Costa Rica,"{'legal_status': 'prescription-only', 'availability': 'easily available', 'prescription_requirements': 'Prescription from a doctor or licensed healthcare professional is required.', 'regulations': 'Some medications available over the counter in other countries may require a prescription in Costa Rica.'}"
Strattera,Czech Republic,"{'legal_status': 'prescription-only', 'availability': 'restricted', 'prescription_requirements': 'A valid prescription from a licensed healthcare provider is required.', 'regulations': ""Subject to the EU's Opium Act and the Amendment to the Medicinal Products Act No. 378/2007 Coll.""}"
Strattera,Denmark,"{'legal_status': 'prescription-only', 'availability': 'easily available', 'prescription_requirements': 'Original paper version of the prescription must be sent to the pharmacy by letter or shown in person; emailing prescriptions is not allowed.', 'regulations': 'The sale of prescription medicine is subject to extensive regulation to support health policy considerations such as equal and easy access to safe and effective medicine.'}"
Strattera,Estonia,"{'legal_status': 'prescription-only', 'availability': 'easily available', 'prescription_requirements': 'Prescription from a licensed medical practitioner (doctor or pharmacist)', 'regulations': 'Ordering medications online is legal; Finnish electronic prescriptions are valid in Estonia.'}"
Strattera,Finland,"{'legal_status': 'prescription-only', 'availability': 'restricted', 'prescription_requirements': 'A prescription is required, which can be a paper prescription or European ePrescription.', 'regulations': 'Prescription medicines can be purchased in Finland with either a paper prescription or European ePrescription. Foreign prescriptions are accepted in Finnish pharmacies.'}"
Strattera,France,"{'legal_status': 'prescription-only', 'availability': 'restricted', 'prescription_requirements': 'A prescription from a licensed medical practitioner is required.', 'regulations': 'Prescription drugs in France are regulated to ensure safety and efficacy, and online ordering of medications is legal.'}"
Strattera,Germany,"{'legal_status': 'prescription-only', 'availability': 'restricted', 'prescription_requirements': 'You require a prescription from a psychiatrist, along with diagnostic papers and a statement from your current doctor regarding dosage.', 'regulations': 'A prescription delivered by a doctor in one EU country is valid in all other EU countries.'}"
Strattera,Greece,"{'legal_status': 'prescription-only', 'availability': 'restricted', 'prescription_requirements': 'Prescribed by a licensed medical professional', 'regulations': 'Must be obtained through a pharmacy with a valid prescription.'}"
Strattera,Hungary,"{'legal_status': 'legal', 'availability': 'restricted', 'prescription_requirements': 'Valid prescription accepted from Serbia; must pay in full as insurance is not accepted.', 'regulations': 'Prescription medications must be checked for legality upon arrival; original packaging and sealed blister packs are recommended.'}"
Strattera,Iceland,"{'legal_status': 'prescription-only', 'availability': 'easily available', 'prescription_requirements': 'Prescription from a licensed medical practitioner, such as a doctor or pharmacist', 'regulations': 'Medicinal products are subject to a prescription unless a change in legal status is approved by The Icelandic Medicines Agency.'}"
Strattera,Ireland,"{'legal_status': 'Prescription-only', 'availability': 'Restricted', 'prescription_requirements': 'Product subject to medical prescription which may not be renewed (A)', 'regulations': 'Supply through pharmacies only'}"
Strattera,Israel,"{'legal_status': 'prescription-only', 'availability': 'restricted', 'prescription_requirements': ""Dispensed with a doctor's prescription only"", 'regulations': 'Medications must be approved through a bureaucratic process; tightly regulated market; available only from pharmacies.'}"
Strattera,Italy,"{'legal_status': 'prescription-only', 'availability': 'not available', 'prescription_requirements': 'A prescription from a licensed healthcare provider is required to obtain Strattera in Italy.', 'regulations': 'Eli Lilly Italia S.p.A. will cease to market Strattera hard capsules in Italy from 30 September 2023.'}"
Strattera,Japan,"{'legal_status': 'prescription-only', 'availability': 'restricted', 'prescription_requirements': 'Must consult with a Japanese practitioner and obtain proper documentation for importation.', 'regulations': 'Strict regulations on stimulants due to potential for abuse; may require an import certificate.'}"
Strattera,Korea,"{'legal_status': 'prescription-only', 'availability': 'restricted', 'prescription_requirements': 'Must have a valid prescription from a licensed physician in South Korea.', 'regulations': 'Importing Strattera for personal use is allowed with proper documentation, including prescriptions and a medical certificate.'}"
Strattera,Latvia,"{'legal_status': 'prescription-only', 'availability': 'restricted', 'prescription_requirements': 'Must be prescribed by a GP; certificate required for substances in Schedules II and III.', 'regulations': 'Medicinal products for personal use containing substances from Schedules II and III need certification from the competent authority.'}"
Strattera,Lithuania,"{'legal_status': 'prescription-only', 'availability': 'restricted', 'prescription_requirements': 'Prescribed using prescription forms', 'regulations': 'Dispensed in pharmacies following specific rules approved by the Minister of Health; reimbursed means of medical aids to inhabitants.'}"
Strattera,Luxembourg,"{'legal_status': 'prescription-only', 'availability': 'not available', 'prescription_requirements': 'Prescription required from a licensed healthcare professional', 'regulations': 'Subject to specific regulations related to controlled substances and prescription medications.'}"
Strattera,Mexico,"{'legal_status': 'prescription-only', 'availability': 'easily available', 'prescription_requirements': 'Prescription from a Mexican doctor', 'regulations': 'Certain medications require a prescription; many drugs available over the counter'}"
Strattera,Netherlands,"{'legal_status': 'prescription-only', 'availability': 'restricted', 'prescription_requirements': 'Prescription from a doctor or specialist is required.', 'regulations': 'The Dutch Medicines Act prohibits the sale of unregistered pharmaceutical products; exceptions exist under specific circumstances.'}"
Strattera,New Zealand,"{'legal_status': 'prescription-only', 'availability': 'restricted', 'prescription_requirements': ""Available only with a doctor's prescription"", 'regulations': 'Defined as a prescription medicine under the Medicines Act 1981; funding restrictions removed as of 1 July 2019; brand changes effective from 1 December 2019.'}"
Strattera,Norway,"{'legal_status': 'prescription-only', 'availability': 'restricted', 'prescription_requirements': 'Visit a doctor for a prescription', 'regulations': 'Guidance provided by Norwegian Regulation Forskrift om legemidler and EU Directive 2001/83/EC'}"
Strattera,Poland,"{'legal_status': 'prescription-only', 'availability': 'restricted', 'prescription_requirements': 'Product subject to medical prescription which may not be renewed', 'regulations': ""Detailed information on the import of prescription drugs, narcotic drugs and psychotropic substances used in treatments and medical devices from the U.S. to Poland is available on the Chief Pharmaceutical Inspectorate's website.""}"
Strattera,Portugal,"{'legal_status': 'prescription-only', 'availability': 'restricted', 'prescription_requirements': 'A prescription from a licensed healthcare provider is required.', 'regulations': 'Regulated by the Portuguese Medicines Agency (Infarmed) and can only be dispensed by licensed pharmacies.'}"
Strattera,Slovak Republic,"{'legal_status': 'prescription-only', 'availability': 'restricted', 'prescription_requirements': 'Visit a doctor for a prescription', 'regulations': 'Legal ban on the re-export of medicines; availability affected by parallel exports'}"
Strattera,Slovenia,"{'legal_status': 'Zdravilo z dovoljenjem za promet', 'availability': 'restricted', 'prescription_requirements': 'A physician may prescribe the medicament which is approved for circulation in Slovenia and is listed in the positive or intermediate list of the ZZZS', 'regulations': 'Medicaments may be prescribed by physicians and collected in pharmacies with a special prescription.'}"
Strattera,Spain,"{'legal_status': 'prescription-only', 'availability': 'restricted', 'prescription_requirements': 'A valid prescription from a licensed healthcare provider is required.', 'regulations': 'Possession and use are regulated, and cross-border prescriptions are allowed without a specific template.'}"
Strattera,Sweden,"{'legal_status': 'prescription-only', 'availability': 'restricted', 'prescription_requirements': 'Valid prescription from a licensed healthcare provider', 'regulations': 'Regulated by the Health data Register Act (1998:543) and associated regulation (2005:363), managed by the Swedish eHealth Agency.'}"
Strattera,Switzerland,"{'legal_status': 'prescription-only', 'availability': 'easily available', 'prescription_requirements': 'Covered by Swiss Mandatory Health Insurance; requires a prescription from a licensed healthcare provider.', 'regulations': 'Monitored by the Swiss Agency for Therapeutic Products; classified as a controlled substance.'}"
Strattera,Turkey,"{'legal_status': 'prescription-only', 'availability': 'restricted', 'prescription_requirements': 'A valid prescription is required to obtain Strattera in Turkey.', 'regulations': 'Strattera is regulated as a prescription medication in Turkey, and ordering from websites that sell it without a prescription is a violation.'}"
Strattera,United Kingdom,"{'legal_status': 'prescription-only', 'availability': 'restricted', 'prescription_requirements': 'A valid prescription from a licensed healthcare provider is required.', 'regulations': 'Strattera is classified as a controlled substance and should not be used in children under 6 years of age.'}"
Strattera,United States,"{'legal_status': 'prescription-only', 'availability': 'easily available', 'prescription_requirements': 'Licensed healthcare professionals such as psychiatrists, primary care physicians, and psychiatric nurse practitioners can prescribe Strattera after evaluating symptoms and medical history.', 'regulations': 'Strattera is not a Schedule II controlled substance, allowing prescriptions for more than a 30-day supply, unlike stimulants which have strict federal regulations.'}"
